2168;5967752-1;44240244-ЗЦП1;;"АО ""ЛОК ""Ок-Жетпес""";Товар;Набор реагентов;Ферментативный очиститель для гематологического анализатора Micro CC-18 1л. Срок не менее 2-х лет.;2;Флакон;27 300.00;54 600.00;2021-06-14 10:55:00;2021-06-21 10:55:24;Запрос ценовых предложений;Закупка не состоялась2169;5967752-1;37852588-ЗЦП1;;"АО ""ЛОК ""Ок-Жетпес""";Товар;Реагент лизирующий;Лизирующий раствор для гематологического анализатора Micro CC-18- 500 мл. Срок не менее 2-х лет;1;Флакон;28 600.00;28 600.00;2021-06-14 10:55:00;2021-06-21 10:55:24;Запрос ценовых предложений;Закупка не состоялась2170;5967752-1;41961398-ЗЦП3;;"АО ""ЛОК ""Ок-Жетпес""";Товар;Перекись водорода;Перекись водорода 37%. концентрированная, медицинская;36;Литр (куб. дм.);650.00;23 400.00;2021-06-14 10:55:00;2021-06-21 10:55:24;Запрос ценовых предложений;Закупка не состоялась2171;5967752-1;44240040-ЗЦП3;;"АО ""ЛОК ""Ок-Жетпес""";Товар;Ибупрофен;Долгит крем 20 гр., срок не менее 2х лет;20;Штука;809.28;16 185.60;2021-06-14 10:55:00;2021-06-21 10:55:24;Запрос ценовых предложений;Закупка не состоялась2172;5967752-1;44240232-ЗЦП1;;"АО ""ЛОК ""Ок-Жетпес""";Товар;Глюкоза;Глюкоза-Витал В 05.02, срок не менее 2 лет;2;Набор;10 385.00;20 770.00;2021-06-14 10:55:00;2021-06-21 10:55:24;Запрос ценовых предложений;Закупка не состоялась2173;5967752-1;44242828-ЗЦП1;;"АО ""ЛОК ""Ок-Жетпес""";Товар;Вода изотоническая;Изотонический разбавитель дилюент-20п. для гематологического анализатора Micro CC-18. Срок не менее 2-х лет;1;Флакон;20 300.00;20 300.00;2021-06-14 10:55:00;2021-06-21 10:55:24;Запрос ценовых предложений;Закупка не состоялась2174;5967752-1;44694742-ЗЦП1;;"АО ""ЛОК ""Ок-Жетпес""";Товар;Артикаин, Эпинефрин;Адреналина гидротартрат 0,18%/1 мл №10 р-р д/ин.амп.;5;Упаковка;1 050.00;5 250.00;2021-06-14 10:55:00;2021-06-21 10:55:24;Запрос ценовых предложений;Закупка не состоялась2175;5967752-1;44694637-ЗЦП1;;"АО ""ЛОК ""Ок-Жетпес""";Товар;Панкреатин;Мезим форте №20;6;Упаковка;1 515.00;9 090.00;2021-06-14 10:55:00;2021-06-21 10:55:24;Запрос ценовых предложений;Закупка не состоялась2176;5967752-1;44240208-ЗЦП1;;"АО ""ЛОК ""Ок-Жетпес""";Товар;Набор реагентов;Холестерин-Витал В 13.12, срок не менее 2 лет;2;Набор;9 900.00;19 800.00;2021-06-14 10:55:00;2021-06-21 10:55:24;Запрос ценовых предложений;Закупка не состоялась2177;5965916-1;44690730-ЗЦП1;;"АО ""ЛОК ""Ок-Жетпес""";Товар;Кабель;Кабель КГ 5*2,5.РБ - 72,8%. Пищеблок;15;Метр;600.00;9 000.00;2021-06-11 18:15:35;2021-06-18 18:15:44;Запрос ценовых предложений;Закупка не состоялась2178;5965916-1;44691146-ЗЦП1;;"АО ""ЛОК ""Ок-Жетпес""";Товар;Трубчатая изоляция;Каучуковая изоляция. Каучуковая теплоизоляция для труб с внутренним диаметром 6,35 мм. РБ - 72,8%. Пищеблок;15;Метр;250.00;3 750.00;2021-06-11 18:15:35;2021-06-18 18:15:44;Запрос ценовых предложений;Закупка не состоялась2179;5965916-1;44690645-ЗЦП1;;"АО ""ЛОК ""Ок-Жетпес""";Товар;Труба;Труба медная, диаметр 12,7 мм, ГОСТ617-2006, круглая, трубы медные, материал медь Cu, сплав М1М ДКРНМ. РБ - 72,8% Пищеблок;15;Метр;8 509.00;127 635.00;2021-06-11 18:15:35;2021-06-18 18:15:44;Запрос ценовых предложений;Закупка состоялась2180;5965916-1;44691772-ЗЦП1;;"АО ""ЛОК ""Ок-Жетпес""";Товар;Анкер;Анкера-гильза HLC 16х140/90. РБ - 72,8%. Пищеблок;6;Штука;946.00;5 676.00;2021-06-11 18:15:35;2021-06-18 18:15:44;Запрос ценовых предложений;Закупка не состоялась2181;5965916-1;44690817-ЗЦП1;;"АО ""ЛОК ""Ок-Жетпес""";Товар;Выключатель;Автоматический выключатель, трех полюсный 25а, отключающая способность 10кА. РБ - 72,8%. Пищеблок;1;Штука;7 400.00;7 400.00;2021-06-11 18:15:35;2021-06-18 18:15:44;Запрос ценовых предложений;Закупка не состоялась2182;5965916-1;44691289-ЗЦП1;;"АО ""ЛОК ""Ок-Жетпес""";Товар;Трубчатая изоляция;Каучуковая изоляция. Каучуковая теплоизоляция для труб с внутренним диаметром 12,7 мм. РБ - 72,8%. Пищеблок;15;Метр;200.00;3 000.00;2021-06-11 18:15:35;2021-06-18 18:15:44;Запрос ценовых предложений;Закупка не состоялась2183;5965916-1;44690547-ЗЦП1;;"АО ""ЛОК ""Ок-Жетпес""";Товар;Труба;Труба медная, диаметр 6,35 мм, ГОСТ617-2006, круглая, трубы медные, материал медь Cu, сплав М1М ДКРНМ. РБ - 72,8% Пищеблок;15;Метр;5 118.00;76 770.00;2021-06-11 18:15:35;2021-06-18 18:15:44;Запрос ценовых предложений;Закупка состоялась2184;5965916-1;44691587-ЗЦП1;;"АО ""ЛОК ""Ок-Жетпес""";Товар;Лента киперная;Лента киперная, 20 мм, 50+1м, цвет черный. РБ - 72,8%. Пищеблок;5;Штука;2 200.00;11 000.00;2021-06-11 18:15:35;2021-06-18 18:15:44;Запрос ценовых предложений;Закупка не состоялась2185;5965840-1;44685566-ЗЦП1;;"АО ""ЛОК ""Ок-Жетпес""";Товар;Плита теплоизоляционная;Минераловатная изоляция - утеплитель Экролл толщина 50мм, длина 10980мм, ширина 1220мм, площадь 26,791м2. Баймагамбетова.;1;Штука;8 350.00;8 350.00;2021-06-11 17:50:47;2021-06-21 17:50:00;Запрос ценовых предложений;Закупка не состоялась2186;5965533-1;44686464-ЗЦП1;;"АО ""ЛОК ""Ок-Жетпес""";Товар;Средство моющее;Моющие таблетки для проконвектомата Rational. Очиститель в таблетках для проконвектомата Rational. Состав - гидроксид натрия, метасиликат динатрия, этоксилат жирного спирта. Вес одной таблетки 60 грамм. За счет собственных средств - 4кг. Альжапарова.Ш;12;Килограмм;6 412.00;76 944.00;2021-06-11 17:30:52;2021-06-21 17:30:04;Запрос ценовых предложений;Закупка не состоялась2187;5965533-1;44686324-ЗЦП1;;"АО ""ЛОК ""Ок-Жетпес""";Товар;Средство моющее;Средство для чистки кух. Посуды Химитек 5л. Химитек чудодей - антинагар-пенаактив - пенное щелочное средство для удаления пищевых нагаров. Предназначено для ручной и автоматической мойки пиевогго технологического оборудования итз нержавеющей стали. Состав: вода 30%, щелочь 30%, неиногенные ПАВ 5%, неорганическая соль 5%, коплексообразователь 5%. Показатель pH 1% раствора 12,0-14,0. За счет собственных средств - 4канистр. Альжапароваю.Ш;10;Штука;7 010.00;70 100.00;2021-06-11 17:30:52;2021-06-21 17:30:04;Запрос ценовых предложений;Закупка не состоялась2188;5965442-1;44695462-ЗЦП1;;"АО ""ЛОК ""Ок-Жетпес""";Товар;Хладагент;Хладон R404a Наименование показателя Значение. Средняя молекулярная масса г/моль 97,6. Температура кипения при 1.013 бар °С -46,3. Плотность жидкости при 25 °C, г/cм3 1,01. Критическая температура °C 72,0. Критическое давление MПa 3,78. Скрытая теплота парообразования (при 1,013 бар) кДж/кг 86,0. Температурный перепад °C -16,9 баллон 13,6 кг. Бюджетные средства.;1;Штука;41 103.00;41 103.00;2021-06-11 17:00:03;2021-06-18 17:00:24;Запрос ценовых предложений;Закупка не состоялась2189;5965442-1;44695819-ЗЦП1;;"АО ""ЛОК ""Ок-Жетпес""";Товар;Хладагент;Хладон R22 Наименование показателя Значение. Массовая доля нелетучего остатка, %, не более 0,001. Кислотность Окраска индикатора не должна изменяться. Объемная доля дифторхлорметана (CHCIF2), %, не менее 99,9. Объемная доля примесей, определяемых хроматографическим методом, %, не более 0,1. Массовая доля воды, %, не более 0,001 баллон 13,6 кг. Бюджетные средства.;1;Штука;49 200.00;49 200.00;2021-06-11 17:00:03;2021-06-18 17:00:24;Запрос ценовых предложений;Закупка не состоялась2190;5965291-1;44688250-ЗЦП1;;"АО ""ЛОК ""Ок-Жетпес""";Товар;Стакан;Стаканы под сок. 290 мл из стекла, поверхность гладкая, цилиндрической формы, высота 13-14 см. диаметр 6 см. За счет собственных средств - 340 шт. Альжапарова. Ш;1000;Штука;500.00;500 000.00;2021-06-11 16:45:54;2021-06-21 16:45:19;Запрос ценовых предложений;Закупка состоялась2191;5961357-1;44555808-ОИ2;;"АО ""ЛОК ""Ок-Жетпес""";Товар;Шайба плоская;Шайба. Резьба метиза М10. Внешний диаметр, мм 30. Внутренний диаметр, мм 10,5 Материал оцинкованная сталь. DIN 9021. Твердость 8.8. Покрытие оцинкованный.;400;Штука;20.00;8 000.00;2021-06-10 17:42:08;2021-06-15 18:00:00;Из одного источника по несостоявшимся закупкам;Закупка состоялась2192;5961357-1;44555492-ОИ2;;"АО ""ЛОК ""Ок-Жетпес""";Товар;Гайка шестигранная;Гайка. Диаметр резьбы М10. Размер под ключ, мм 17. Материал сталь. Направление резьбы правая. Шаг резьбы 1,5 . DIN 934. Класс прочности 8. Покрытие цинк.;300;Штука;20.00;6 000.00;2021-06-10 17:42:08;2021-06-15 18:00:00;Из одного источника по несостоявшимся закупкам;Закупка состоялась2193;5961357-1;44555148-ОИ2;;"АО ""ЛОК ""Ок-Жетпес""";Товар;Болт с шестигранной головкой;Болт. Длина, мм 55. Диаметр резьбы М10. ISO 4017. Вид головки шестигранная, Класс прочности 8.8. Размер под ключ 17(16). DIN 933. ГОСТ 7798-70. Шаг резьбы, мм 1,5, Направление резьбы правая. Тип полная резьба. Материал сталь гальванически оцинкованная. Покрытие оцинкованный.;300;Штука;75.00;22 500.00;2021-06-10 17:42:08;2021-06-15 18:00:00;Из одного источника по несостоявшимся закупкам;Закупка состоялась2194;5961052-1;37853000-ОИ2;;"АО ""ЛОК ""Ок-Жетпес""";Товар;Водонагреватель;Бойлер (Бойлер);1;Штука;1 000 000.00;1 000 000.00;2021-06-10 17:12:09;2021-06-15 18:00:00;Из одного источника по несостоявшимся закупкам;Закупка состоялась2195;5960198-1;44550656-ОИ2;;"АО ""ЛОК ""Ок-Жетпес""";Товар;Замок;Замок на балконную дверь, длина: 200-210 см, ширина: 1,5 см. Глубина сердцевины: 3 см, высота сердцевины: 5,3 см;30;Штука;1 500.00;45 000.00;2021-06-10 15:48:08;2021-06-15 18:00:00;Из одного источника по несостоявшимся закупкам;Закупка не состоялась2196;5959549-1;44568529-ОИ2;;"АО ""ЛОК ""Ок-Жетпес""";Товар;Отвод;Отвод д.50 мм металлический под сварку;10;Штука;982.14;9 821.40;2021-06-10 14:33:08;2021-06-15 18:00:00;Из одного источника по несостоявшимся закупкам;Закупка состоялась2197;5959549-1;44568443-ОИ2;;"АО ""ЛОК ""Ок-Жетпес""";Товар;Резьба сантехническая;Резьба д. 25 мм;10;Штука;165.18;1 651.80;2021-06-10 14:33:08;2021-06-15 18:00:00;Из одного источника по несостоявшимся закупкам;Закупка состоялась2198;5959549-1;44568424-ОИ2;;"АО ""ЛОК ""Ок-Жетпес""";Товар;Резьба сантехническая;Резьба д. 20 мм;10;Штука;151.79;1 517.90;2021-06-10 14:33:08;2021-06-15 18:00:00;Из одного источника по несостоявшимся закупкам;Закупка состоялась2199;5959549-1;44568241-ОИ2;;"АО ""ЛОК ""Ок-Жетпес""";Товар;Резьба сантехническая;Резьба д. 15 мм;10;Штука;133.93;1 339.30;2021-06-10 14:33:08;2021-06-15 18:00:00;Из одного источника по несостоявшимся закупкам;Закупка состоялась2200;5959293-1;44581651-ОИ2;;"АО ""ЛОК ""Ок-Жетпес""";Товар;Пневмогидроусилитель привода сцепления;Пневмогидроусилитель на КАМАЗ;1;Штука;26 000.00;26 000.00;2021-06-10 13:18:09;2021-06-15 18:00:00;Из одного источника по несостоявшимся закупкам;Закупка состоялась2201;5959293-1;44583122-ОИ2;;"АО ""ЛОК ""Ок-Жетпес""";Товар;Цилиндр сцепления;Главный цилиндр сцепления КАМАЗ;2;Штука;13 928.00;27 856.00;2021-06-10 13:18:09;2021-06-15 18:00:00;Из одного источника по несостоявшимся закупкам;Закупка состоялась2202;5959293-1;44583184-ОИ2;;"АО ""ЛОК ""Ок-Жетпес""";Товар;Цилиндр сцепления;Рабочий цилиндр сцепления ПАЗ;4;Штука;3 935.00;15 740.00;2021-06-10 13:18:09;2021-06-15 18:00:00;Из одного источника по несостоявшимся закупкам;Закупка состоялась2203;5953292-1;43785356-ОИ3;;"АО ""ЛОК ""Ок-Жетпес""";Товар;Вилка;Вилка промышленная серии Magnum ССИ-013 PSN01-016-3;15;Штука;3 000.00;45 000.00;2021-06-09 12:24:07;2021-06-14 18:00:00;Из одного источника по несостоявшимся закупкам;Закупка состоялась2204;5953292-1;43785311-ОИ3;;"АО ""ЛОК ""Ок-Жетпес""";Товар;Электророзетка;Розетка промышленная серии Magnum ССИ-113 PSN11-016-3;15;Штука;4 300.00;64 500.00;2021-06-09 12:24:07;2021-06-14 18:00:00;Из одного источника по несостоявшимся закупкам;Закупка состоялась2205;5949084-1;42607438-ЗЦП1;;"АО ""ЛОК ""Ок-Жетпес""";Товар;Матрас;Матрас двуспальный, размер 180*205;5;Штука;51 780.00;258 900.00;2021-06-11 09:45:00;2021-06-18 09:45:00;Запрос ценовых предложений;Закупка состоялась2206;5949084-1;42607547-ЗЦП1;;"АО ""ЛОК ""Ок-Жетпес""";Товар;Матрас;Матрас односпальный, размер 90*195;4;Штука;30 400.00;121 600.00;2021-06-11 09:45:00;2021-06-18 09:45:00;Запрос ценовых предложений;Закупка состоялась2207;5949084-1;42607496-ЗЦП1;;"АО ""ЛОК ""Ок-Жетпес""";Товар;Матрас;Матрас односпальный, размер 95*195;4;Штука;30 400.00;121 600.00;2021-06-11 09:45:00;2021-06-18 09:45:00;Запрос ценовых предложений;Закупка состоялась2208;5947109-1;44491718-ЗЦП2;;"АО ""ЛОК ""Ок-Жетпес""";Товар;Фара;Фонарь передний ПФ-204 12В. Фонарь предений металлический ПФ-204 12В на МТЗ-920. Артикул ПФ-204.00.00;2;Штука;3 500.00;7 000.00;2021-06-08 11:40:00;2021-06-15 11:40:00;Запрос ценовых предложений;Закупка не состоялась2209;5947109-1;44492536-ЗЦП2;;"АО ""ЛОК ""Ок-Жетпес""";Товар;Комплект проводов;Пучок проводов рамный (правый) 53215-3724044. артикул 53215-3724044.;1;Штука;13 000.00;13 000.00;2021-06-08 11:40:00;2021-06-15 11:40:00;Запрос ценовых предложений;Закупка не состоялась2210;5947109-1;44492562-ЗЦП2;;"АО ""ЛОК ""Ок-Жетпес""";Товар;Комплект проводов;Пучок проводов рамный (левый) 53215-3724045. артикул 53215-3724045.;1;Штука;13 000.00;13 000.00;2021-06-08 11:40:00;2021-06-15 11:40:00;Запрос ценовых предложений;Закупка не состоялась2211;5947109-1;44491855-ЗЦП2;;"АО ""ЛОК ""Ок-Жетпес""";Товар;Фара;Фара МТЗ передняя квдратная 12В. Фара дорожная ФГ-308-04, МТЗ 12В.;2;Штука;9 000.00;18 000.00;2021-06-08 11:40:00;2021-06-15 11:40:00;Запрос ценовых предложений;Закупка не состоялась2212;5947109-1;44491816-ЗЦП2;;"АО ""ЛОК ""Ок-Жетпес""";Товар;Фара;"Фара рабочего освещения МТЗ 12В. Фара рабочая круглая ТГ-218. Металлический корпус. Номинальное напряжение-12В. Тип ламп НЗ. Крепление; болтом М12 с гайкой. Подключение к бортовой сети проводом длиной 390мм. С 2-х контактной колодкой.";2;Штука;9 000.00;18 000.00;2021-06-08 11:40:00;2021-06-15 11:40:00;Запрос ценовых предложений;Закупка не состоялась2213;5946791-1;44494851-ЗЦП2;;"АО ""ЛОК ""Ок-Жетпес""";Товар;Шпатель;Шпатель резиновый, белый, в комплекте 3 штуки;3;Комплект;450.00;1 350.00;2021-06-08 11:15:00;2021-06-15 11:15:00;Запрос ценовых предложений;Закупка не состоялась2214;5946791-1;44494698-ЗЦП2;;"АО ""ЛОК ""Ок-Жетпес""";Товар;Шпатель;Шпатель фасадный 50 мм, нержавеющее полотно, рукоятка - пластмасса;4;Штука;640.00;2 560.00;2021-06-08 11:15:00;2021-06-15 11:15:00;Запрос ценовых предложений;Закупка не состоялась2215;5946791-1;44495246-ЗЦП2;;"АО ""ЛОК ""Ок-Жетпес""";Товар;Стартер;Кикстартер для газонокосилки;1;Штука;1 200.00;1 200.00;2021-06-08 11:15:00;2021-06-15 11:15:00;Запрос ценовых предложений;Закупка не состоялась2216;5946791-1;44494778-ЗЦП2;;"АО ""ЛОК ""Ок-Жетпес""";Товар;Шпатель;Шпатель фасадный 30 мм, нержавеющее полотно, рукоятка - пластмасса;4;Штука;540.00;2 160.00;2021-06-08 11:15:00;2021-06-15 11:15:00;Запрос ценовых предложений;Закупка не состоялась2217;5946791-1;44494345-ЗЦП2;;"АО ""ЛОК ""Ок-Жетпес""";Товар;Труба;"Стержень-удлинитель ЗУБР ""ЭКСПЕРТ"" телескопический для малярного инструмента, 2, 4 - 4, 8 м";4;Штука;6 100.00;24 400.00;2021-06-08 11:15:00;2021-06-15 11:15:00;Запрос ценовых предложений;Закупка не состоялась2218;5946791-1;44494982-ЗЦП2;;"АО ""ЛОК ""Ок-Жетпес""";Товар;Растворитель;Растворитель 646, канистра 5 литров, ГОСТ 18188-72;3;Штука;3 180.00;9 540.00;2021-06-08 11:15:00;2021-06-15 11:15:00;Запрос ценовых предложений;Закупка не состоялась2219;5946791-1;44494730-ЗЦП2;;"АО ""ЛОК ""Ок-Жетпес""";Товар;Шпатель;Шпатель фасадный 100 мм, нержавеющее полотно, рукоятка - пластмасса;4;Штука;660.00;2 640.00;2021-06-08 11:15:00;2021-06-15 11:15:00;Запрос ценовых предложений;Закупка не состоялась2220;5946271-1;44486693-ЗЦП2;;"АО ""ЛОК ""Ок-Жетпес""";Товар;Муфта;Муфта соединительная СММ-20. Предназначены для соединения двух отрезков металлорукава д 20 ,Материал: цинковый сплав;45;Штука;505.00;22 725.00;2021-06-08 10:45:00;2021-06-15 10:45:00;Запрос ценовых предложений;Закупка не состоялась2221;5946271-1;44484675-ЗЦП2;;"АО ""ЛОК ""Ок-Жетпес""";Товар;Выключатель;автоматический выключатель зашиты двигателя ВА-431 13-18А. Артикул производителя 21231DEK Номинальный ток длительной нагрузки Iu-18 А Диапазон настройки устройства защиты от перегрузки с- 13 А Диапазон настройки устройства защиты от перегрузки по- 18 А Степень защиты IP-IP20 Номинальная предел.наибольшая отключающ.способность Icu при 400В перемен.тока AC-15 кА Номинальное напряжение по 690 В Количество полюсов-3 Чувствительный к обрыву фазы Да Система расцепления Термомагнитная Тип присоединения главной электрической цепи Винтовое соединение Тип элемента управления Клавиша;2;Штука;8 030.00;16 060.00;2021-06-08 10:45:00;2021-06-15 10:45:00;Запрос ценовых предложений;Закупка не состоялась2222;5946271-1;44489335-ЗЦП2;;"АО ""ЛОК ""Ок-Жетпес""";Товар;Спираль;Спираль с бусами 1,5 кВт универсальная для сковород, СЭЧ-0,45 (70л), длина 2,7 метра;4;Штука;4 300.00;17 200.00;2021-06-08 10:45:00;2021-06-15 10:45:00;Запрос ценовых предложений;Закупка не состоялась