№;id объявления;id лота;id пункта плана;Заказчик;Вид предмета закупок;Наименование закупаемых товаров, работ, услуг на государственном языке (в соответствии с КТРУ);Дополнительная характеристика;Количество, объём;Единица измерения;Цена за единицу, тенге;Сумма, утвержденная для закупки, тенге;Начало приема заявок;Окончание приема заявок;Способ закупки;Статус лота1;2;3;4;5;6;7;8;9;10;11;12;13;14;15;161;7173061-1;46685557-ОИ5;;"АО ""ЛОК ""Ок-Жетпес""";Товар;Cредство моющее;Средство от жира 0,,5 л.(прачечная);25;Бутылка;350.00;8 750.00;2022-03-17 12:22:58;2022-03-22 18:00:00;Из одного источника по несостоявшимся закупкам;Закупка состоялась2;7167933-1;51757154-ОИ2;;"АО ""ЛОК ""Ок-Жетпес""";Товар;Гвоздь строительный;Гвозди жидкие тюбик под пистолет;20;Штука;2 000.00;40 000.00;2022-03-16 19:12:09;2022-03-21 18:00:00;Из одного источника по несостоявшимся закупкам;Закупка состоялась3;7167933-1;51762454-ОИ2;;"АО ""ЛОК ""Ок-Жетпес""";Товар;Проволока;Проволока оцинкованная диаметр 1,2мм;2;Килограмм;15 500.00;31 000.00;2022-03-16 19:12:09;2022-03-21 18:00:00;Из одного источника по несостоявшимся закупкам;Закупка состоялась4;7167933-1;51760292-ОИ2;;"АО ""ЛОК ""Ок-Жетпес""";Товар;Бур;Бур по бетону SDS +M22*460мм;2;Штука;4 500.00;9 000.00;2022-03-16 19:12:09;2022-03-21 18:00:00;Из одного источника по несостоявшимся закупкам;Закупка состоялась5;7167933-1;51759113-ОИ2;;"АО ""ЛОК ""Ок-Жетпес""";Товар;Диск;Диск отрезной по металлу 125*2,3*22,23 мм, материал абразив;50;Штука;250.00;12 500.00;2022-03-16 19:12:09;2022-03-21 18:00:00;Из одного источника по несостоявшимся закупкам;Закупка состоялась6;7167933-1;51758961-ОИ2;;"АО ""ЛОК ""Ок-Жетпес""";Товар;Диск;Диск отрезной по металлу 230*1,6-22мм;60;Штука;350.00;21 000.00;2022-03-16 19:12:09;2022-03-21 18:00:00;Из одного источника по несостоявшимся закупкам;Закупка не состоялась7;7161299-1;46685455-ОИ2;;"АО ""ЛОК ""Ок-Жетпес""";Услуга;Услуги по организации/проведению конференций/семинаров/форумов/конкурсов/корпоративных/спортивных/культурных/праздничных и аналогичных мероприятий;"Концертная программа ""Наурыз мейрамы"", согласно технической спецификации";1;Одна услуга;500 000.00;500 000.00;2022-03-16 12:42:08;2022-03-21 18:00:00;Из одного источника по несостоявшимся закупкам;Закупка состоялась8;7160987-1;46685528-ОИ2;;"АО ""ЛОК ""Ок-Жетпес""";Работа;Работы по ремонту/реставрации текстильных и аналогичных изделий;Работы по ремонту бильярдных столов;1;Работа;794 200.00;794 200.00;2022-03-16 12:25:14;2022-03-21 18:00:00;Из одного источника по несостоявшимся закупкам;Закупка состоялась9;7160006-1;47420293-ОИ2;;"АО ""ЛОК ""Ок-Жетпес""";Работа;Работы погрузочно-разгрузочные;Услуги погрузчика, объем ковша 3 м куб. (60 часов), согласно графика и технической спецификации (согласно заявки Заказчика, в течение года);1;Работа;535 714.28;535 714.28;2022-03-16 11:42:09;2022-03-21 18:00:00;Из одного источника по несостоявшимся закупкам;Закупка состоялась10;7120523-1;51476100-ЗЦП3;;"АО ""ЛОК ""Ок-Жетпес""";Товар;Сахар;ГОСТ 33222-2015. Сахар в мешках по 25-50 кг ,сухой,без комков,кристалы однородного строения с ясно выраженными гранями,сыпучие,не липкие,без комков непробеленного сахара и посторонних примесей,белого цвета с блеском,вкус сладкий,без посторонних привкусов и запахов,растворимость в !!!ВНИМАНИЕ ЕЖЕДНЕВНАЯ ПОСТАВКА малыми партиями по заявке !!!;8225;Килограмм;366.07;3 010 925.75;2022-03-11 14:40:00;2022-03-18 14:40:00;Запрос ценовых предложений;Закупка не состоялась11;7118562-1;47475801-ОИ2;;"АО ""ЛОК ""Ок-Жетпес""";Товар;Трубочка;Трубочки для коктейля разноцветные гофрированные длина 25 см.,;70000;Штука;3.00;210 000.00;2022-03-11 12:22:15;2022-03-16 18:00:00;Из одного источника по несостоявшимся закупкам;Закупка состоялась12;7115936-1;46685401-ЗЦП2;;"АО ""ЛОК ""Ок-Жетпес""";Товар;Средство дезинфицирующее;Концентрированное дезинфицирующее средство, которое можно применять для обработки поверхностей всех видов, а также санитарно-технического оборудования и жёсткой мебели 2л.;20;Флакон;15 000.00;300 000.00;2022-03-11 11:05:00;2022-03-18 11:05:00;Запрос ценовых предложений;Закупка не состоялась13;7115040-1;51528036-ЗЦП2;;"АО ""ЛОК ""Ок-Жетпес""";Товар;Перчатки;Перчатки Х/Б С ПВХ (ИХС);200;Пара;200.00;40 000.00;2022-03-11 10:25:00;2022-03-18 10:25:22;Запрос ценовых предложений;Закупка не состоялась14;7115040-1;51525702-ЗЦП2;;"АО ""ЛОК ""Ок-Жетпес""";Товар;Краги;Краги сварщика спилковые;12;Штука;3 500.00;42 000.00;2022-03-11 10:25:00;2022-03-18 10:25:22;Запрос ценовых предложений;Закупка не состоялась15;7114630-1;46685554-ОИ4;;"АО ""ЛОК ""Ок-Жетпес""";Товар;Средство моющее;Средство от пятен 0,5 л. (прачечная);10;Бутылка;6 705.00;67 050.00;2022-03-11 11:39:33;2022-03-16 11:39:33;Из одного источника по несостоявшимся закупкам;Закупка состоялась16;7114019-1;46685386-ЗЦП2;;"АО ""ЛОК ""Ок-Жетпес""";Товар;Панты марала;Настойка из пантов марала (флакон 200 мл.);40;Литр (куб. дм.);13 500.00;540 000.00;2022-03-11 09:50:00;2022-03-18 09:50:00;Запрос ценовых предложений;Закупка не состоялась17;7114019-1;46685380-ЗЦП2;;"АО ""ЛОК ""Ок-Жетпес""";Товар;Панты марала;Отвар пантовый;340;Литр (куб. дм.);3 800.00;1 292 000.00;2022-03-11 09:50:00;2022-03-18 09:50:00;Запрос ценовых предложений;Закупка состоялась18;7113811-1;18704856-ОЛ-ОИ2;51502803;"АО ""ЛОК ""Ок-Жетпес""";Товар;Огурец;Огурцы свежие ОТБОРНЫЕ тепличные ,ГОСТ 33932-2016 короткоплодные,не перезревшие,мелкие,средние,без признаков гнили,яркого зеленого цвета,не более 11 см - 14 см,размер по поперечному срезу не более 4 см. НЕ ДОПУСТИМЫ плоды уродливой формы,желтые,раздавленные,гнилые,пораженные болезнями,с вызревшими семенами(семенники) . Предпочтителен сорт Меринда.ВНИМАНИЕ!!! При приемке на продуктовом складе скоропортящихся овощей и фруктов а именно : огурцы,помидоры перец болгарский ,кабачки,баклажаны,груши,яблоки,слива,персик,абрикос,банан,мандарин,апельсины,салат,зелень и др., производится переборка и отбраковывание принимаемых фруктов и овощей, представителем поставщика в присутствии кладовщика прод.склада. ЕЖЕДНЕВНАЯ поставка малыми партиями;1849;Килограмм;794.64;1 469 289.36;2022-03-11 09:36:58;2022-03-16 18:00:00;Из одного источника по несостоявшимся закупкам;Закупка состоялась19;7113811-1;18704856-ОЛ-ОИ2;51506228;"АО ""ЛОК ""Ок-Жетпес""";Товар;Черешня;Черешня ОТБОРНАЯ, ГОСТ 33801-2016 ,крупная,спелая,свежая, сочная,с веточками,без гнили и повреждений насекомыми, сладкая. Упакованная в ячейковые прокладные картонные листы в ящики в 1-2 слоя.ВНИМАНИЕ!!! При приемке на продуктовом складе скоропортящихся овощей и фруктов а именно : огурцы,помидоры перец болгарский ,кабачки,баклажаны,груши,яблоки,слива,черешня,персик,абрикос,банан,мандарин,апельсины,салат,зелень и др., производится переборка и отбраковывание принимаемых фруктов и овощей, представителем поставщика в присутствии кладовщика прод.склада. ЕЖЕДНЕВНАЯ поставка малыми партиями;700;Килограмм;1 741.07;1 218 749.00;2022-03-11 09:36:58;2022-03-16 18:00:00;Из одного источника по несостоявшимся закупкам;Закупка состоялась20;7113811-1;18704856-ОЛ-ОИ2;51507147;"АО ""ЛОК ""Ок-Жетпес""";Товар;Яблоко позднее;ГОСТ 11482-96 Рыба эсколар копченая высшего сорта, без наружных повреждений и кровоподтеков,пластованная,холодного копчения,слабосоленая до 7%.С чистой,сухой поверхностью от белого до молочного цвета,консистенция мышечной ткани от нежной и сочной до плотной,вкус и запах копчености,без порочащих признаков,содержание.Упаковыванная в картонные ящики устланные внутри пергаментом или оберточной бумагой,в торцовых стенках ящика отверстия для циркуляции воздуха.ОБЯЗАТЕЛЬНЫ СРОКИ ИЗГОТОВЛЕНИЯ. Поставка малыми партиями 3 раза в неделю.;1000;Килограмм;544.64;544 640.00;2022-03-11 09:36:58;2022-03-16 18:00:00;Из одного источника по несостоявшимся закупкам;Закупка состоялась21;7113811-1;18704856-ОЛ-ОИ2;51499078;"АО ""ЛОК ""Ок-Жетпес""";Товар;Картофель;ГОСТ 7176-2017. Картофель ОТБОРНЫЙ. корнеплоды ровные,без гнили,с малым количеством глазков,диаметр не менее 8 см,сухой без примеси земли ,без повреждений насекомыми,без механических повреждений,на срезе долго не темнеющая,вкусная,с хорошей лежкостью,столовые или унивесальные сорта . Расфасованный в сетчатые мешки по 30-40 кг Поставка ЕЖЕДНЕВНАЯ малыми партиями;6377;Килограмм;241.07;1 537 303.39;2022-03-11 09:36:58;2022-03-16 18:00:00;Из одного источника по несостоявшимся закупкам;Закупка состоялась22;7113811-1;18704856-ОЛ-ОИ2;51506269;"АО ""ЛОК ""Ок-Жетпес""";Товар;Чеснок;СТ РК 1245-2004 Чеснок ОТБОРНЫЙ,чистый,сухой,без проростков и корешков,производство Казахстан,предпочтительны сорта ЮБИЛЕЙНЫЙ,СТАРОБЕЛЬСКИЙ. Упакованный в маленькие транспортировочные сетки по 1-2 кг .ЕЖЕДНЕВНАЯ поставка малыми партиями;126;Килограмм;1 303.57;164 249.82;2022-03-11 09:36:58;2022-03-16 18:00:00;Из одного источника по несостоявшимся закупкам;Закупка состоялась23;7113811-1;18704856-ОЛ-ОИ2;51502732;"АО ""ЛОК ""Ок-Жетпес""";Товар;Морковь;ОТБОРНАЯ морковь ГОСТ 32284-2013 чистая,без земляных примесей, крупная столовых сортов,без гнили,без ботвы,яркого оранжевого цвета,гладкая некорявая. Размер по наибольшему срезу не менее 3 см и не более 7 см,НЕ ДОПУСТИМЫ корнеплоды треснутые с открытой сердцевиной,увядшие, подмороженые,с механическими повреждениями и повреждениями насекомыми и грызунами.ЕЖЕДНЕВНАЯ поставка малыми партиями;2260;Килограмм;339.29;766 795.40;2022-03-11 09:36:58;2022-03-16 18:00:00;Из одного источника по несостоявшимся закупкам;Закупка состоялась24;7113811-1;18704856-ОЛ-ОИ2;51506147;"АО ""ЛОК ""Ок-Жетпес""";Товар;Тыква;ТЫКВА ОТБОРНАЯ ГОСТ 7975-2013.столовые сорта,свежая, сочная,без гнили,на вкус сладкая. Мякоть на срезе яркого оранжевого цвета. НЕ ДОПУСКАЮТСЯ повреждения гнилью,механические,грызунами,болезнями,насекомыми.ЕЖЕДНЕВНАЯ поставка малыми партиями.;250;Килограмм;642.86;160 715.00;2022-03-11 09:36:58;2022-03-16 18:00:00;Из одного источника по несостоявшимся закупкам;Закупка состоялась25;7113811-1;18704856-ОЛ-ОИ2;51503327;"АО ""ЛОК ""Ок-Жетпес""";Товар;Помидор;ПОМИДОРЫ ТЕПЛИЧНЫЕ ОТБОРНЫЕ СТ РК ГОСТ 51810-2004 однородного созревания,спелые,без желтых прожилок на срезе,одного колибра,не кислые сорта,без повреждений насекомыми и механических повреждений,НЕ ДОПУСТИМЫ гнилые,заплесневелые,раздавленные плодыВНИМАНИЕ!!! При приемке на продуктовом складе скоропортящихся овощей и фруктов а именно : огурцы,помидоры перец болгарский ,кабачки,баклажаны,груши,яблоки,слива,персик,абрикос,банан,мандарин,апельсины,салат,зелень и др., производится переборка и отбраковывание принимаемых фруктов и овощей, представителем поставщика в присутствии кладовщика прод.склада. Поставка ЕЖЕДНЕВНАЯ малыми партиями;2070;Килограмм;879.46;1 820 482.20;2022-03-11 09:36:58;2022-03-16 18:00:00;Из одного источника по несостоявшимся закупкам;Закупка состоялась26;7113811-1;18704856-ОЛ-ОИ2;51502259;"АО ""ЛОК ""Ок-Жетпес""";Товар;Салат;Листья салата ОТБОРНЫЕ, гост 33985-2016 свежие листья, сочные, ярко-зеленого цвета,с усеченными кореньями или в рассадочных стаканах,каждый пучок упакованный в товарный целофановый кулек ,листья не увядшие,предпочтительны сорта РОМЕН,ЛОЛЛО РОССО,ЛОЛЛО БИОНДО,ДУБОВЫЙ,ФРИЗИ. ВНИМАНИЕ!!! При приемке на продуктовом складе скоропортящихся овощей и фруктов а именно : огурцы,помидоры перец болгарский ,кабачки,баклажаны,груши,яблоки,слива,персик,абрикос,банан,мандарин,апельсины,салат,зелень и др., производится переборка и отбраковывание принимаемых фруктов и овощей, представителем поставщика в присутствии кладовщика прод.склада. ЕЖЕДНЕВНАЯ поставка малыми партиями;266;Килограмм;1 473.21;391 873.86;2022-03-11 09:36:58;2022-03-16 18:00:00;Из одного источника по несостоявшимся закупкам;Закупка состоялась27;7113811-1;18704856-ОЛ-ОИ2;51502437;"АО ""ЛОК ""Ок-Жетпес""";Товар;Лук-порей;Лук зеленый ОТБОРНЫЙ гост 34214-2017 свежий, сочный, темно-зеленого цвета,без корней,луковичка без земли,без признаков самосогревания и подмораживания,без наличия стрелок.ВНИМАНИЕ!!! При приемке на продуктовом складе скоропортящихся овощей и фруктов а именно : огурцы,помидоры перец болгарский ,кабачки,баклажаны,груши,яблоки,слива,персик,абрикос,банан,мандарин,апельсины,салат,зелень и др., производится переборка и отбраковывание принимаемых фруктов и овощей, представителем поставщика в присутствии кладовщика прод.склада.ЕЖЕДНЕВНАЯ поставка малыми партиями;28;Килограмм;1 428.57;39 999.96;2022-03-11 09:36:58;2022-03-16 18:00:00;Из одного источника по несостоявшимся закупкам;Закупка состоялась28;7113811-1;18704856-ОЛ-ОИ2;51503241;"АО ""ЛОК ""Ок-Жетпес""";Товар;Петрушка;Петрушка ОТБОРНАЯ ГОСТ 34212-2017 .Зелень свежая, сочная, темно-зеленого цвета,пучки без кореньев или в рассадочных стаканах,каждый пучок упакованный в товарный целофановый кулек ,без желтых листочков,без повреждений насекомыми и гнили,без следов самосогревания и подморозки.ВНИМАНИЕ!!! При приемке на продуктовом складе скоропортящихся овощей и фруктов а именно : огурцы,помидоры перец болгарский ,кабачки,баклажаны,груши,яблоки,слива,персик,абрикос,банан,мандарин,апельсины,салат,зелень и др., производится переборка и отбраковывание принимаемых фруктов и овощей, представителем поставщика в присутствии кладовщика прод.склада. Поставка ЕЖЕДНЕВНАЯ малыми партиями;190;Килограмм;1 651.79;313 840.10;2022-03-11 09:36:58;2022-03-16 18:00:00;Из одного источника по несостоявшимся закупкам;Закупка состоялась29;7113811-1;18704856-ОЛ-ОИ2;51506177;"АО ""ЛОК ""Ок-Жетпес""";Товар;Укроп;Зелень укропа ГОСТ 32856-2014. свежая, сочная, темно-зеленого цвета,пучки без кореньев или в рассадочных стаканах,каждый пучок упакованный в товарный целофановый кулек ,без желтых листочков,без повреждений насекомыми и гнили,без следов самосогревания и подморозки.ВНИМАНИЕ!!! При приемке на продуктовом складе скоропортящихся овощей и фруктов а именно : огурцы,помидоры перец болгарский ,кабачки,баклажаны,груши,яблоки,слива,персик,абрикос,банан,мандарин,апельсины,салат,зелень и др., производится переборка и отбраковывание принимаемых фруктов и овощей, представителем поставщика в присутствии кладовщика прод.склада. Поставка ежедневная малыми партиями;200;Килограмм;1 651.79;330 358.00;2022-03-11 09:36:58;2022-03-16 18:00:00;Из одного источника по несостоявшимся закупкам;Закупка состоялась30;7113811-1;18704856-ОЛ-ОИ2;51504083;"АО ""ЛОК ""Ок-Жетпес""";Товар;Свекла;ГОСТ 32285-2013 .Свекла диаметром не более 15 см,столовые сорта,сладкая,без белых прожилок на срезе,яркого бордового цвета.без ботвы и земли,без механических повреждений и повреждений насекомыми,НЕ допустимы парша,гниль,плоды менее 8 см в поперечном срезе,увядшие,морщинистые.ЕЖЕДНЕВНАЯ поставка малыми партиями;855;Килограмм;366.07;312 989.85;2022-03-11 09:36:58;2022-03-16 18:00:00;Из одного источника по несостоявшимся закупкам;Закупка состоялась31;7113811-1;18704856-ОЛ-ОИ2;51507058;"АО ""ЛОК ""Ок-Жетпес""";Товар;Лист щавеля;Щавель свежий. ГОСТ 34301-2017 Зелень молодая свежая сочная,темнозеленого цвета ,без корня и рассадочного горшка. Без повреждения насекомыми и мехнических повреждений,без семенных стеблей .ЕЖЕДНЕВНАЯ поставка малыми партиями;80;Килограмм;1 116.07;89 285.60;2022-03-11 09:36:58;2022-03-16 18:00:00;Из одного источника по несостоявшимся закупкам;Закупка состоялась32;7112992-1;48050833-ОИ3;;"АО ""ЛОК ""Ок-Жетпес""";Товар;Ананас;ГОСТ 33443-2015.Ананасы консервированные кольцами или кусочками .ж/б 850 мл,массой нетто 820 гр,в слабо сладком сиропе,без консервантов,банки не поврежденные,без бомбажа. В/С ,поставка малыми партиями 3 раза в неделю;203.93;Килограмм;1 941.96;396 023.90;2022-03-11 10:23:47;2022-03-16 10:23:47;Из одного источника по несостоявшимся закупкам;Закупка состоялась