644;6814135-1;46685398-ЗЦП1;;"АО ""ЛОК ""Ок-Жетпес""";Товар;Наконечник;Ректальный одноразовый наконечник со вставкой - подводящая и сливная трубки для аппартатов колоног. В ящике 75 штук.;2000;Комплект;2 445.00;4 890 000.00;2022-02-07 14:10:00;2022-02-14 14:10:00;Запрос ценовых предложений;Закупка состоялась645;6803111-1;51098800-ЗЦП1;;"АО ""ЛОК ""Ок-Жетпес""";Товар;Лампа накаливания;Светодиодная лампа. Цвет теплый, Диаметр колбы - 17 мм, длина колбы – 45 мм(без разъемов), тип силовое соединение - g4 (штырьковое), мощность 6w, напряжение DC12V, форма – цилиндрическая. СС - 100%;50;Штука;800.00;40 000.00;2022-02-04 17:55:29;2022-02-14 09:00:38;Запрос ценовых предложений;Закупка состоялась646;6803111-1;51098542-ЗЦП1;;"АО ""ЛОК ""Ок-Жетпес""";Товар;Лампа светодиодная;Светодиодная лампа, цокольЕ 27, 10Вт, теплый свет 3000 К. СС - 100%;200;Штука;700.00;140 000.00;2022-02-04 17:55:29;2022-02-14 09:00:38;Запрос ценовых предложений;Закупка состоялась647;6803111-1;51098391-ЗЦП1;;"АО ""ЛОК ""Ок-Жетпес""";Товар;Краска;"Акриловая водоэмульсионная краска для стен и потолков внутри помещения. Матовая, белая, светостойкая, моющаяся, ведро 25 кг. Свойства: - Моющаяся; - Высокая укрывистость и белизна; - Образует воздухопроницаемое покрытие, позволяющее поверхности """"дышать""""; - Экологически чистая; - Без запаха, нетоксичная; - Легкое нанесение, удобная в работе; - Колеруется водорастворимыми красителями или универсальными пигментными пастами; - Применима для окрашивания обоев под покраску; - Пожаровзрывобезопасная. БС - 100 %";28;Штука;14 500.00;406 000.00;2022-02-04 17:55:29;2022-02-14 09:00:38;Запрос ценовых предложений;Закупка состоялась648;6781399-1;47475782-ОИ2;;"АО ""ЛОК ""Ок-Жетпес""";Товар;Маска;Маска косметологическая одноразовая, тканевая в упаковке по 25 штук (ЛРО);300;Упаковка;410.00;123 000.00;2022-02-03 11:09:11;2022-02-08 18:00:00;Из одного источника по несостоявшимся закупкам;Закупка состоялась649;6778536-1;49740391-ОИ4;;"АО ""ЛОК ""Ок-Жетпес""";Товар;Пропан-бутан;Автомобильный газ в талонах. при наличии АЗС в г. Щучинск, п.Бурабай, п.Зеленый бор, срок действия талонов до 31.05.2022г.;15000;Литр (куб. дм.);62.50;937 500.00;2022-02-03 09:45:20;2022-02-08 09:45:20;Из одного источника по несостоявшимся закупкам;Закупка состоялась650;6752955-1;47611806-ЗЦП1;;"АО ""ЛОК ""Ок-Жетпес""";Товар;Элемент нагревательный;Бойлер для чая на 15 литров;2;Штука;32 142.86;64 285.72;2022-02-01 12:45:00;2022-02-08 12:45:10;Запрос ценовых предложений;Закупка не состоялась651;6751773-1;50866567-ЗЦП1;;"АО ""ЛОК ""Ок-Жетпес""";Товар;Субпродукты конские;Кишки,карын,карта промытые,чистые,без содержимого желудочнокишечного тракта,без паразитов,темных пятен,очищенные поваренной солью,без слизи,сгустков крови,без внутреннего жира на карын.;492;Килограмм;2 500.00;1 230 000.00;2022-02-01 17:30:00;2022-02-08 17:30:00;Запрос ценовых предложений;Закупка состоялась652;6751773-1;50865445-ЗЦП1;;"АО ""ЛОК ""Ок-Жетпес""";Товар;Субпродукты говяжьи;Языки говяжьи,должны быть освобождены от подъязычной мускульной ткани,лимфатических узлов,подъязычной кости,гортани,слизи и крови,хорошо промыты,без нарушения наружных оболочек,не загрязнены посторонними примесями(солома,камни). Поставка 3 раза в неделю малями партиями;840;Килограмм;3 220.00;2 704 800.00;2022-02-01 17:30:00;2022-02-08 17:30:00;Запрос ценовых предложений;Закупка состоялась653;6751773-1;50865344-ЗЦП1;;"АО ""ЛОК ""Ок-Жетпес""";Товар;Печень говяжья;Печень говяжья, в/с,без желчного пузыря желчегонных протоков,без дополнительных образований,полостей,кровяных сгустков,лимфатических узлов,без наружных кровеносных сосудов,цвет светло-коричневый или светло-красный,охлажденная,но не замороженная;628;Килограмм;1 540.00;967 120.00;2022-02-01 17:30:00;2022-02-08 17:30:00;Запрос ценовых предложений;Закупка состоялась654;6751773-1;50864846-ЗЦП1;;"АО ""ЛОК ""Ок-Жетпес""";Товар;Баранина;баранина 1 категории,тушами, охлажденное,но не замороженное,удовлетворительно развитые мышцы,остистые отростки позвонков в области спины и холки слегка выступают,подкожный жир покравает тонким слоем тушу на спине и на пояснице.На ребрах,в области крестца и таза допускаются просветы.Клеймят на лопаточных,бедренных частях и на грудинке с правой стороны ,без курдючного сала( должно быть удалено),мясо яркого красного цвета,жир белого цвета,без посторонних запахов,обескровленное,без кровоподтеков,без поврежденных тканей,без сгустков крови,без загрязнений содержимым желудочнокишечного тракта.Мясо доброкачественное покрытое бледно-красной пленкой,при разрезе слегка влажное,но не липкое,консистенция эластичная.;3595;Килограмм;3 000.00;10 785 000.00;2022-02-01 17:30:00;2022-02-08 17:30:00;Запрос ценовых предложений;Закупка состоялась655;6751773-1;50867840-ЗЦП1;;"АО ""ЛОК ""Ок-Жетпес""";Товар;Молоко натуральное;Молоко цельное спец. питание, пастеризованное или не пастеризованное, фляжное, жирность 3,2%-3,3% без добавления порошкового сырья. Ежедневная поставка обязательна, кислотность не должна превышать 16-18°Т. Молоко должно быть однородным, без осадка, сгустков жира, без отстоя сливок, без посторонних запахов, примесей, мусора, белого цвета. Предоставление акта экспертизы на каждую поставляемую партию продукта обязательно.;3780;Килограмм;300.00;1 134 000.00;2022-02-01 17:30:00;2022-02-08 17:30:00;Запрос ценовых предложений;Закупка не состоялась656;6751773-1;49962069-ЗЦП1;;"АО ""ЛОК ""Ок-Жетпес""";Товар;Вода;Минеральная вода биогенная, негазированная , бутыли емкостью 18,9 литра, минерализация - 180-260, гидрокарбонат - 90-150, сульфаты - 35-65, хлориды - 15-40, натрий 10-20, калий - 0,4-3, кальций - 25-40, магний - 5-15, фтор- 0,5-0,7. Обработанная монохроматическим красным светом гелий-неонового источника.;5247;Бутылка;580.00;3 043 260.00;2022-02-01 17:30:00;2022-02-08 17:30:00;Запрос ценовых предложений;Закупка не состоялась657;6751773-1;50865074-ЗЦП1;;"АО ""ЛОК ""Ок-Жетпес""";Товар;Конина;Конина. Мясо 1 категории упитанности,мышцы развиты удовлетворительно,остистые отростки позвонков,седалищные позвонки и маклаки выступают не резко,подкожный жир не выраженный, покрывает тушу от 8 ребра к седалищным буграм,а на шее,лопатках,передних ребрах,в тазовой полости и области паха только не большие участки жира. туша разделенная на пять частей, цвет говядины от светло красного до темно-красного, жир белый или слегка желтоватый, без посторонних запахов, мясо полностью остывшее, но не замороженное,обескровленное,не имеет сгустков крови,кровоподтеков,побитостей,бахромок и поврежденных тканей,остатков внутренних органов,загрязнений содержимым желудочнокишечного тракта,Забой свежий,корочка подсыхания бледно-розовая или бледно-красная. На разрезе не влажное,т.е. не оставляет влажного пятна на фильтровальной бумаге.НА КАЖДОМ раструбе обязательно ветеринарное клеймо.Сопроводительныйе документы на каждую поставляемую партию:1) ветеринарная справка,2)акт экспертизы,3)справка об эпидблагополучии хозяйства.;3733;Килограмм;3 200.00;11 945 600.00;2022-02-01 17:30:00;2022-02-08 17:30:00;Запрос ценовых предложений;Закупка состоялась658;6751773-1;50865641-ЗЦП1;;"АО ""ЛОК ""Ок-Жетпес""";Товар;Субпродукты овец;Субпродукты баранины, печень, почки, сердце светло-коричневого или светло-красного цвет;178;Килограмм;2 000.00;356 000.00;2022-02-01 17:30:00;2022-02-08 17:30:00;Запрос ценовых предложений;Закупка состоялась659;6751773-1;50866737-ЗЦП1;;"АО ""ЛОК ""Ок-Жетпес""";Товар;Субпродукты конские;Печень конины в/с,без желчного пузыря желчегонных протоков,без дополнительных образований,полостей,кровяных сгустков,лимфатических узлов,без наружных кровеносных сосудов,цвет светло-коричневый или светло-красный,охлажденная,но не замороженая ¶;93;Килограмм;2 000.00;186 000.00;2022-02-01 17:30:00;2022-02-08 17:30:00;Запрос ценовых предложений;Закупка состоялась660;6751773-1;50867613-ЗЦП1;;"АО ""ЛОК ""Ок-Жетпес""";Товар;Масло;Масло сливочное коровье высшего сорта, жирность не менее 72,5 %, натуральное, без добавления порошкового сырья, не соленое, изготовленное из свежих пастеризованных сливок. Консистенция плотная, однородная, поверхность на разрезе слабо блестящая, сухая на вид или с одиночными мельчайшими капельками влаги. Упаковка монолитом в картонном ящике массой по 10-20 кг. Сроки годности до 9 месяцев. Не допустимы посторонние примеси вкуса и запаха, плесневелость, сырный и плесневелый привкус, прогорклость, привкус лежалого масла, штафф, металлический и салистый привкус, хлевный, травяной или кормовой привкус, привкус пригорелых сливок, крошливость, масло с вытекающей влагой, мраморность, неплотная набивка масла, мажущаяся, творожистая консистенция, мягкая и слабая консистенция, нечистый запах, рванный и нечистый пергамент. Категорически недопустимы в составе растительные жиры и масла. Поставка малыми партиями 3 раза в неделю.;2236;Килограмм;3 585.00;8 016 060.00;2022-02-01 17:30:00;2022-02-08 17:30:00;Запрос ценовых предложений;Закупка состоялась661;6751773-1;50867907-ЗЦП1;;"АО ""ЛОК ""Ок-Жетпес""";Товар;Молоко натуральное;Молоко коровье, цельное ,пастеризованное или не пастеризованное, фляжное, жирн 3,2%-3,3% без добавления порошкового сырья.Ежедневная поставка обязательна,кислотность не должна привышать 16-18оТ.Молоко должно быть однородным,без осадка,сгустков жира,без отстоя сливок,без посторонних запахов,примесей,мусора,белого цвета.Предоставление АКТА экспертизы на каждую поставляемую партию продукта - обязательно.;23611;Килограмм;300.00;7 083 300.00;2022-02-01 17:30:00;2022-02-08 17:30:00;Запрос ценовых предложений;Закупка не состоялась662;6744370-1;50864769-ОК1;;"АО ""ЛОК ""Ок-Жетпес""";Товар;Говядина;Мясо говядина 1 категории упитанности, мышцы развиты удовлетворительно, остистые отростки позвонков, седалищные позвонки и маклаки выступают не резко, подкожный жир не выраженный, покрывает тушу от 8 ребра к седалищным буграм, а на шее, лопатках, передних ребрах, в тазовой полости и области паха только не большие участки жира. туша разделенная на пять частей, цвет говядины от светло красного до темно-красного, жир белый или слегка желтоватый, без посторонних запахов, мясо полностью остывшее, но не замороженное, обескровленное, не имеет сгустков крови, кровоподтеков, побитостей, бахромок и поврежденных тканей, остатков внутренних органов, загрязнений содержимым желудочно-кишечного тракта, Забой свежий, корочка подсыхания бледно-розовая или бледно-красная. На разрезе не влажное, т.е. не оставляет влажного пятна на фильтровальной бумаге. НА КАЖДОМ раструбе обязательно ветеринарное клеймо.;12220;Килограмм;2 620.00;32 016 400.00;2022-03-03 12:01:16;2022-03-09 12:01:16;Открытый конкурс;Закупка состоялась663;6744370-1;50867497-ОК1;;"АО ""ЛОК ""Ок-Жетпес""";Товар;Кумыс;Кумыс, двухсуточного приготовления, кислотность не более 120 °T. ежедневная поставка.;18805;Литр (куб. дм.);1 000.00;18 805 000.00;2022-03-03 12:01:16;2022-03-09 12:01:16;Открытый конкурс;Закупка не состоялась664;6739654-1;49940319-ОИ3;;"АО ""ЛОК ""Ок-Жетпес""";Услуга;Услуги инкассаторских агентств;Услуги инкассации денег в кассе;1;Одна услуга;267 857.14;267 857.14;2022-01-31 12:58:00;2022-02-05 18:00:00;Из одного источника по несостоявшимся закупкам;Закупка состоялась665;6723654-1;49740088-ОИ3;;"АО ""ЛОК ""Ок-Жетпес""";Товар;Бензин для двигателей с искровым зажиганием;Бензин АИ-92 в талонах, наличие АЗС в г.Щучинск, г. Нур-Султан срок действие талонов до 31.05.2022 года;5000;Литр (куб. дм.);162.50;812 500.00;2022-01-28 13:19:30;2022-02-02 18:00:00;Из одного источника по несостоявшимся закупкам;Закупка состоялась666;6723652-1;49740391-ОИ3;;"АО ""ЛОК ""Ок-Жетпес""";Товар;Пропан-бутан;Автомобильный газ в талонах. при наличии АЗС в г. Щучинск, п.Бурабай, п.Зеленый бор, срок действия талонов до 31.05.2022г.;15000;Литр (куб. дм.);62.50;937 500.00;2022-01-28 13:19:13;2022-02-02 18:00:00;Из одного источника по несостоявшимся закупкам;Закупка не состоялась667;6712274-1;46685490-ЗЦП1;;"АО ""ЛОК ""Ок-Жетпес""";Услуга;Услуги по предоставлению вычислительных мощностей для физического размещения информации на сервере, постоянно находящемся в сети Интернет;"Оплата за хостинг okzhetpes-burabay.kz; oqjetpes.com";1;Одна услуга;71 428.57;71 428.57;2022-01-27 14:35:00;2022-02-03 14:35:00;Запрос ценовых предложений;Закупка состоялась668;6712274-1;46685487-ЗЦП1;;"АО ""ЛОК ""Ок-Жетпес""";Услуга;Услуги по технической поддержке сайтов;Техническая поддержка сайтов, сопровождение и наполнение контентом (до 10 публикации в месяц, обеспечение траурные версии сайтов, обновление информации сайтов): okzhetpes-burabay.kz, oqjetpes.com;1;Одна услуга;535 714.29;535 714.29;2022-01-27 14:35:00;2022-02-03 14:35:00;Запрос ценовых предложений;Закупка состоялась669;6712274-1;50654905-ЗЦП1;;"АО ""ЛОК ""Ок-Жетпес""";Услуга;Услуги переводческие;Перевод на английский язык новостей сайта okzhetpes-burabay.kz , в течение 2022 года (до 10 публикаций в месяц);1;Одна услуга;196 428.57;196 428.57;2022-01-27 14:35:00;2022-02-03 14:35:00;Запрос ценовых предложений;Закупка состоялась670;6712274-1;50655279-ЗЦП1;;"АО ""ЛОК ""Ок-Жетпес""";Услуга;Услуги по предоставлению доменного имени;Оплата за домены;1;Одна услуга;44 642.86;44 642.86;2022-01-27 14:35:00;2022-02-03 14:35:00;Запрос ценовых предложений;Закупка состоялась671;6712274-1;46685485-ЗЦП1;;"АО ""ЛОК ""Ок-Жетпес""";Услуга;Услуги по технической поддержке сайтов;"Поддержка SMM: instagram; facebook. Обновить визуал страницы, Дизайн для сториса, дизайн для постов, контент-план, обновить таплинк и ежедневная публикация контента.";1;Одна услуга;714 285.71;714 285.71;2022-01-27 14:35:00;2022-02-03 14:35:00;Запрос ценовых предложений;Закупка состоялась672;6710513-1;46685550-ЗЦП1;;"АО ""ЛОК ""Ок-Жетпес""";Товар;Порошок;Отбеливающее средство для белого, порошок 3 кг. (прачечная);546;Килограмм;5 112.00;2 791 152.00;2022-01-27 12:15:00;2022-02-03 12:15:00;Запрос ценовых предложений;Закупка состоялась673;6710513-1;46685552-ЗЦП1;;"АО ""ЛОК ""Ок-Жетпес""";Товар;Средство моющее;Ополаскиватель для белья (прачечная);720;Литр (куб. дм.);469.00;337 680.00;2022-01-27 12:15:00;2022-02-03 12:15:00;Запрос ценовых предложений;Закупка состоялась674;6708568-1;47500031-ОК1;;"АО ""ЛОК ""Ок-Жетпес""";Товар;Газ природный;Сжиженный углеводородный газ СПБТ с содержанием бутана не более 60%, по ГОСТ 204-480, с доставкой на объекта Заказчика, октябрь-декабрь 2022 года. Согласно графика поставки и Технической спецификации;200000;Килограмм;133.93;26 786 000.00;2022-03-02 14:20:41;2022-03-10 18:00:00;Открытый конкурс;Закупка не состоялась675;6708568-1;47412534-ОК1;;"АО ""ЛОК ""Ок-Жетпес""";Товар;Газ природный;Сжиженный углеводородный газ СПБТ с содержанием бутана не более 60%, по ГОСТ 204-480, с доставкой на объекта Заказчика, апрель-июнь 2022 года. Согласно графика поставки и Технической спецификации;75000;Килограмм;133.93;10 044 750.00;2022-03-02 14:20:41;2022-03-10 18:00:00;Открытый конкурс;Закупка не состоялась676;6708568-1;47499991-ОК1;;"АО ""ЛОК ""Ок-Жетпес""";Товар;Газ природный;Сжиженный углеводородный газ СПБТ с содержанием бутана не более 60%, по ГОСТ 204-480, с доставкой на объекта Заказчика, июль-сентябрь 2022 года. Согласно графика поставки и Технической спецификации;70000;Килограмм;133.93;9 375 100.00;2022-03-02 14:20:41;2022-03-10 18:00:00;Открытый конкурс;Закупка не состоялась677;6701666-1;47475651-ЗЦП1;;"АО ""ЛОК ""Ок-Жетпес""";Товар;Средство дезинфицирующее;Чистящее средство дезинфицирующее гель для унитаза, бутылке с изогнутым горлышком (ЛРО);70;Штука;1 340.00;93 800.00;2022-01-27 11:00:00;2022-02-03 11:00:00;Запрос ценовых предложений;Закупка состоялась678;6701666-1;47475782-ЗЦП1;;"АО ""ЛОК ""Ок-Жетпес""";Товар;Маска;Маска косметологическая одноразовая, тканевая в упаковке по 25 штук (ЛРО);300;Упаковка;410.00;123 000.00;2022-01-27 11:00:00;2022-02-03 11:00:00;Запрос ценовых предложений;Закупка не состоялась