1421;6200270-1;45496801-ЗЦП1;;"АО ""ЛОК ""Ок-Жетпес""";Товар;Шина;Автошины 175\70 R13 82Т, зимние, шипованные.;4;Штука;21 200.00;84 800.00;2021-08-23 09:30:00;2021-09-01 18:00:00;Запрос ценовых предложений;Закупка состоялась1422;6200270-1;45496891-ЗЦП1;;"АО ""ЛОК ""Ок-Жетпес""";Товар;Шина;Автошины 185\70 R14 XL 92T, зимние, шипованные, протектор направленный.;4;Штука;26 400.00;105 600.00;2021-08-23 09:30:00;2021-09-01 18:00:00;Запрос ценовых предложений;Закупка состоялась1423;6200270-1;45497628-ЗЦП1;;"АО ""ЛОК ""Ок-Жетпес""";Товар;Кольцо уплотнительное;Кольцо манжеты 55111-3104053;4;Штука;6 600.00;26 400.00;2021-08-23 09:30:00;2021-09-01 18:00:00;Запрос ценовых предложений;Закупка состоялась1424;6200270-1;45496733-ЗЦП1;;"АО ""ЛОК ""Ок-Жетпес""";Товар;Шина;Автошина зимняя шипованная, размеры-185 R14С, индекс нагрузки 102/100, индекс скорости Q 160 км/ч, протектор- симметричный, применение - город и трасса. Каркас -С.;4;Штука;35 000.00;140 000.00;2021-08-23 09:30:00;2021-09-01 18:00:00;Запрос ценовых предложений;Закупка состоялась1425;6200270-1;45497900-ЗЦП1;;"АО ""ЛОК ""Ок-Жетпес""";Товар;Кольцо проставочное;Кольцо проставочное 53205-3104044;4;Штука;530.00;2 120.00;2021-08-23 09:30:00;2021-09-01 18:00:00;Запрос ценовых предложений;Закупка не состоялась1426;6200270-1;45497072-ЗЦП1;;"АО ""ЛОК ""Ок-Жетпес""";Товар;Гайка специальная;Гайка подшипника задней ступицы КАМАЗ. Артикул 53205-3104077;4;Штука;3 630.00;14 520.00;2021-08-23 09:30:00;2021-09-01 18:00:00;Запрос ценовых предложений;Закупка состоялась1427;6200270-1;45496952-ЗЦП1;;"АО ""ЛОК ""Ок-Жетпес""";Товар;Сальник;Сальник задней ступицы в сборе КАМАЗ (142х168х16) ПР. Артикул 864129-02;4;Штука;1 100.00;4 400.00;2021-08-23 09:30:00;2021-09-01 18:00:00;Запрос ценовых предложений;Закупка не состоялась1428;6200270-1;45496973-ЗЦП1;;"АО ""ЛОК ""Ок-Жетпес""";Товар;Сальник;Сальник задней ступицы наружный КАМАЗ Евро (85х137). Артикул 53205-3104040-10;4;Штука;1 100.00;4 400.00;2021-08-23 09:30:00;2021-09-01 18:00:00;Запрос ценовых предложений;Закупка не состоялась1429;6200270-1;45497122-ЗЦП1;;"АО ""ЛОК ""Ок-Жетпес""";Товар;Редуктор моста;Редуктор среднего моста КАМАЗ47/15(5.43) Артикул 53205-2502010-40;1;Штука;900 000.00;900 000.00;2021-08-23 09:30:00;2021-09-01 18:00:00;Запрос ценовых предложений;Закупка состоялась1430;6200270-1;45498030-ЗЦП1;;"АО ""ЛОК ""Ок-Жетпес""";Товар;Форсунка топливная;Автомобильные газовые фрсунки STAG W-01 на 4 цилиндра. Страна производитель - Польша, штуцер входа газа - 12мм., штуцер выхода газа - 5мм. Сопротивление катушки - 2 Ом.;1;Штука;23 000.00;23 000.00;2021-08-23 09:30:00;2021-09-01 18:00:00;Запрос ценовых предложений;Закупка не состоялась1431;6200270-1;45497974-ЗЦП1;;"АО ""ЛОК ""Ок-Жетпес""";Товар;Подшипник специализированный;Подшипник 180105 6005-2RS;4;Штука;550.00;2 200.00;2021-08-23 09:30:00;2021-09-01 18:00:00;Запрос ценовых предложений;Закупка не состоялась1432;6200270-1;45497089-ЗЦП1;;"АО ""ЛОК ""Ок-Жетпес""";Товар;Редуктор моста;Редуктор заднего моста КАМАЗ47/15(5.43) Артикул 53205-2402011-40;1;Штука;800 000.00;800 000.00;2021-08-23 09:30:00;2021-09-01 18:00:00;Запрос ценовых предложений;Закупка состоялась1433;6200270-1;45497207-ЗЦП1;;"АО ""ЛОК ""Ок-Жетпес""";Товар;Втулка балансира;Втулка балансира КАМАЗ (комплект 4 штуки) Артикул 55111-2918074-01;4;Штука;6 600.00;26 400.00;2021-08-23 09:30:00;2021-09-01 18:00:00;Запрос ценовых предложений;Закупка состоялась1434;6198411-1;45169239-ЗЦП1;;"АО ""ЛОК ""Ок-Жетпес""";Товар;Креманка;Соусник Pasabahce Chef d=6см. (набор 6 шт). Артикул: 53713.;204;Штука;350.00;71 400.00;2021-08-20 12:50:00;2021-08-27 12:50:57;Запрос ценовых предложений;Закупка состоялась1435;6198411-1;45169783-ЗЦП1;;"АО ""ЛОК ""Ок-Жетпес""";Товар;Фольга;Фольга алюминиевая поварская для запекания 45 см.х100м., 1500гр.;30;Рулон;5 166.00;154 980.00;2021-08-20 12:50:00;2021-08-27 12:50:57;Запрос ценовых предложений;Закупка состоялась1436;6197913-1;45483482-ЗЦП1;;"АО ""ЛОК ""Ок-Жетпес""";Товар;Краска;Краска. Эмалика Алина. Термостойкая супербелая акриловая эмаль для любых поверхностей. Повышенная эластичность. Повышенная устойчивость к пожелтению. Термостойкость до +80 С. Фасовка в банки - вес нетто: 3 кг. (За счет сс 4 штуки);10;Штука;7 500.00;75 000.00;2021-08-20 12:15:00;2021-08-27 12:15:00;Запрос ценовых предложений;Закупка не состоялась1437;6195678-1;44904835-ОИ2;;"АО ""ЛОК ""Ок-Жетпес""";Товар;Корень солодки;"Сироп корня солодки 125 гр. ТОО "" ТК Фарм Актобе"" г.Актобе. Флаконы 125 гр, Срок годности не менее 1 года. (Оплата с РБ-64%)";372;Флакон;240.00;89 280.00;2021-08-19 17:18:10;2021-08-24 18:00:00;Из одного источника по несостоявшимся закупкам;Закупка состоялась1438;6193825-1;16312457-ОЛ-ОИ2;45354335;"АО ""ЛОК ""Ок-Жетпес""";Товар;Краска;"Краска алкидная, масляная, глянцевая, для внутренних и наружных работ на металлических, деревянных, гипсовых, цементных, кирпичных и штукатурных поверхностях, ""Alvan Prince"", 3,5кг. Цвет: Желтый №125";4;Банка условная;4 500.00;18 000.00;2021-08-19 12:21:36;2021-08-24 18:00:00;Из одного источника по несостоявшимся закупкам;Закупка состоялась1439;6193825-1;16312457-ОЛ-ОИ2;45354443;"АО ""ЛОК ""Ок-Жетпес""";Товар;Краска;"Краска алкидная, масляная, глянцевая, для внутренних и наружных работ на металлических, деревянных, гипсовых, цементных, кирпичных и штукатурных поверхностях, ""Alvan Prince"", 3,5кг. Цвет-красный №144";4;Банка условная;4 500.00;18 000.00;2021-08-19 12:21:36;2021-08-24 18:00:00;Из одного источника по несостоявшимся закупкам;Закупка состоялась1440;6193825-1;16312457-ОЛ-ОИ2;45354408;"АО ""ЛОК ""Ок-Жетпес""";Товар;Краска;"Краска алкидная, масляная, глянцевая, для внутренних и наружных работ на металлических, деревянных, гипсовых, цементных, кирпичных и штукатурных поверхностях, ""Alvan Prince"", 3,5кг. Цвет-белый №100";2;Банка условная;4 500.00;9 000.00;2021-08-19 12:21:36;2021-08-24 18:00:00;Из одного источника по несостоявшимся закупкам;Закупка состоялась1441;6191052-1;45175053-ЗЦП1;;"АО ""ЛОК ""Ок-Жетпес""";Товар;Система инфузионная;Системы для инфузий Biola 21G;200;Штука;100.00;20 000.00;2021-08-18 17:20:00;2021-08-25 17:20:37;Запрос ценовых предложений;Закупка не состоялась1442;6188958-1;45337300-ОИ2;;"АО ""ЛОК ""Ок-Жетпес""";Товар;Кран запорный;"Кран сливной ANGELO PO (33D2291) соединение: 2"" IG исполнение: fix размер A: 115 мм размер B1: 90 мм размер B2: 165 мм материал: хромированная латунь";1;Штука;140 000.00;140 000.00;2021-08-18 11:57:11;2021-08-23 18:00:00;Из одного источника по несостоявшимся закупкам;Закупка не состоялась1443;6187634-1;45333815-ЗЦП2;;"АО ""ЛОК ""Ок-Жетпес""";Товар;Датчик температуры;Датчик температуры ГАЗ, ПАЗ охлаждающей жидкости. Артикул ТМ100;6;Штука;660.00;3 960.00;2021-08-18 09:40:00;2021-08-25 16:00:00;Запрос ценовых предложений;Закупка не состоялась1444;6187634-1;45331774-ЗЦП2;;"АО ""ЛОК ""Ок-Жетпес""";Товар;Подушка опоры двигателя;Опора двигателя ПАЗ-3205 дв. ЗМЗ передняя в сборе 53-12-1001020/44;4;Штука;2 530.00;10 120.00;2021-08-18 09:40:00;2021-08-25 16:00:00;Запрос ценовых предложений;Закупка состоялась1445;6187634-1;45332815-ЗЦП2;;"АО ""ЛОК ""Ок-Жетпес""";Товар;Комплект сальников;Флажок( прокладка уплотнительная) держателя заднего сальника коленвала ГАЗ, ПАЗ. Артикул 53-11.1005162 (в упаковке 10 штук);1;Упаковка;1 100.00;1 100.00;2021-08-18 09:40:00;2021-08-25 16:00:00;Запрос ценовых предложений;Закупка не состоялась1446;6187634-1;45331985-ЗЦП2;;"АО ""ЛОК ""Ок-Жетпес""";Товар;Подушка опоры двигателя;Подушка двигателя ПАЗ-3205 дв. ЗМЗ задняя (32051001005);4;Штука;2 200.00;8 800.00;2021-08-18 09:40:00;2021-08-25 16:00:00;Запрос ценовых предложений;Закупка не состоялась1447;6187634-1;45333041-ЗЦП2;;"АО ""ЛОК ""Ок-Жетпес""";Товар;Цилиндр гидроусилителя руля;ГУР КАМАЗ, артикул 4310-3401717;1;Штука;60 500.00;60 500.00;2021-08-18 09:40:00;2021-08-25 16:00:00;Запрос ценовых предложений;Закупка не состоялась1448;6187634-1;45332865-ЗЦП2;;"АО ""ЛОК ""Ок-Жетпес""";Товар;Стремянка;Стремянка М27х430. Артикул 5511-2912408;4;Штука;7 150.00;28 600.00;2021-08-18 09:40:00;2021-08-25 16:00:00;Запрос ценовых предложений;Закупка состоялась1449;6187634-1;45331947-ЗЦП2;;"АО ""ЛОК ""Ок-Жетпес""";Товар;Шпилька с ввинчиваемым концом;Шпилька головки блока цилиндра ГАЗ, ПАЗ (11мм.)(Комплект 36 шт.) с гайками и шайбами. Артикул - ШпилГол11мм(36шт) -01. Комплект шпилек головки блока 12мм. 36 шт. ГАЗ, ПАЗ с гайками и шайбами. Состав комплекта: 1. 291860-П шпилька М11х1х208 - 9 шт. 2. 291826-П шпилька М11х1х195 - 10 шт. 3. 291859-П шпилька М11х1х170 - 9 шт. 4. 291823-П шпилька М11х1х108 - 8 шт. 5. 291823-П 29 шайба - 36 шт. 6. 292798-П гайка М11х1,0 - 36 шт.;1;Штука;27 500.00;27 500.00;2021-08-18 09:40:00;2021-08-25 16:00:00;Запрос ценовых предложений;Закупка не состоялась1450;6187634-1;45332293-ЗЦП2;;"АО ""ЛОК ""Ок-Жетпес""";Товар;Кулиса коробки передач;Муфта соединительная КПП ПАЗ. Артикул 3205-1703096;4;Штука;4 400.00;17 600.00;2021-08-18 09:40:00;2021-08-25 16:00:00;Запрос ценовых предложений;Закупка не состоялась1451;6186394-1;45439174-ЗЦП1;;"АО ""ЛОК ""Ок-Жетпес""";Услуга;Услуги по поверке средств измерений;Услуги по поверке манометра (0-16 бар) механического, циферблатный, с радикальным подключением в количестве 10 шт. и термомера биметаллический, циферблатный, технический (0+120С) с радикльным подключением - 8 шт. (РБ-64% СС-36%);1;Одна услуга;45 000.00;45 000.00;2021-08-17 17:40:00;2021-08-25 16:00:00;Запрос ценовых предложений;Закупка не состоялась1452;6186333-1;44916507-ЗЦП2;;"АО ""ЛОК ""Ок-Жетпес""";Товар;Плитка напольная;Кафель (плитка) половая, 200х200мм, матовая, усиленная РИФЛЕНАЯ, светло-коричневая или серая, согласовать с Заказчиком. (За счет собственных средств - 18 штук);50;Штука;462.00;23 100.00;2021-08-17 17:30:00;2021-08-25 16:00:00;Запрос ценовых предложений;Закупка не состоялась1453;6185477-1;44915337-ЗЦП1;;"АО ""ЛОК ""Ок-Жетпес""";Товар;Круг;"Круг отрезной по камню, алмазный ЗУБР ""ПРОФЕССИОНАЛ"" сегментный универсальный 150х22,2 мм на вакуумной пайке. (За счет собственных средств - 1 штука)";1;Штука;7 000.00;7 000.00;2021-08-17 16:59:00;2021-08-25 16:00:00;Запрос ценовых предложений;Закупка состоялась1454;6185477-1;44915977-ЗЦП1;;"АО ""ЛОК ""Ок-Жетпес""";Товар;Круг;Диск алмазный по камню, ф125х22,2мм, турбо с лазерной перфорацией, сухое резание GROSS. (За счет собственных средств - 1 штука);1;Штука;12 000.00;12 000.00;2021-08-17 16:59:00;2021-08-25 16:00:00;Запрос ценовых предложений;Закупка состоялась1455;6185477-1;44917161-ЗЦП1;;"АО ""ЛОК ""Ок-Жетпес""";Товар;Клей;"Плиточный цементный клей для керамической плитки, 25 кг. Технические показатели: - Максимальная крупность наполнителя ― 0,6 мм; - Соотношение при смешивании ― 5,4-5,6 л воды на 25 кг сухой смеси; - Расход материала ― 5-8 кг на 1 м2 при толщине слоя 3-5 мм; - Температура применения ― от +5 ºС до +30 ºС; - Жизнеспособность раствора ― 2 часа; - Время укладки плитки ― до 8 мин после нанесения раствора; - Время исправления положения плитки ― 5 мин; - Марка по подвижности ― Пк2; - Класс материала, эффективная удельная активность ЕРН (Аэфф), не более ― 370 Бк/кг; - Прочность сцепления с основанием, не менее ― 0,5 Мпа; - Марка по прочности ― М75; - Толщина слоя ― 3-5 мм; - Время высыхания ― 2 дня при +10 ºС, 1 день ― при +20 ºС (За счет собственных средств - 1 штука)";5;Штука;1 800.00;9 000.00;2021-08-17 16:59:00;2021-08-25 16:00:00;Запрос ценовых предложений;Закупка состоялась1456;6185477-1;44916739-ЗЦП1;;"АО ""ЛОК ""Ок-Жетпес""";Товар;Раствор;Сухая штукатурная смесь, мешок 25кг. (За счет собственных средств - 4 штуки);10;Штука;1 850.00;18 500.00;2021-08-17 16:59:00;2021-08-25 16:00:00;Запрос ценовых предложений;Закупка состоялась1457;6185477-1;44916853-ЗЦП1;;"АО ""ЛОК ""Ок-Жетпес""";Товар;Краска;"Краска алкидная масляная глянцевая для внутренних и наружных работ на металлических, деревянных, гипсовых, цементных, кирпичных и штукатурных поверхностях, ""Alvan Prince"", 3,5кг. Цвет: Черный № 199. (За счет собственных средств - 2 штуки)";5;Штука;5 500.00;27 500.00;2021-08-17 16:59:00;2021-08-25 16:00:00;Запрос ценовых предложений;Закупка состоялась1458;6185477-1;44916536-ЗЦП1;;"АО ""ЛОК ""Ок-Жетпес""";Товар;Плитка напольная;Кафель (плитка) половая, 400х400мм, матовая, усиленная, цвет светло-коричневый, перед поставкой согласовать с Заказчиком. Для помещений с большой проходимостью. (За счет собственных средств - 18 штук);50;Штука;700.00;35 000.00;2021-08-17 16:59:00;2021-08-25 16:00:00;Запрос ценовых предложений;Закупка не состоялась1459;6185417-1;44765631-ЗЦП1;;"АО ""ЛОК ""Ок-Жетпес""";Товар;Леска;"Леска для триммеров, ""звезда"", белая, длина 15 м";45;Метр;60.00;2 700.00;2021-08-17 15:58:00;2021-08-24 15:58:00;Запрос ценовых предложений;Закупка не состоялась1460;6185342-1;44991039-ЗЦП1;;"АО ""ЛОК ""Ок-Жетпес""";Товар;Ванна;Ванна стальная , размер: 140*70*40, цвет белый;1;Штука;55 000.00;55 000.00;2021-08-17 15:50:00;2021-08-24 15:50:00;Запрос ценовых предложений;Закупка состоялась1461;6185288-1;45438711-ЗЦП1;;"АО ""ЛОК ""Ок-Жетпес""";Товар;Масло моторное;Полусинтетическое моторное масло для 2х тактных бензиновых двигателей для газонокосилки;12;Литр (куб. дм.);2 300.00;27 600.00;2021-08-17 15:45:00;2021-08-24 15:45:00;Запрос ценовых предложений;Закупка состоялась1462;6185085-1;44495246-ЗЦП1;;"АО ""ЛОК ""Ок-Жетпес""";Товар;Стартер;Кикстартер для газонокосилки;1;Штука;4 500.00;4 500.00;2021-08-17 15:20:00;2021-08-24 15:20:00;Запрос ценовых предложений;Закупка не состоялась1463;6184875-1;45097476-ЗЦП1;;"АО ""ЛОК ""Ок-Жетпес""";Товар;Система специализированная;Комплект оборудования видеомониторинга и контроля помещений.;1;Штука;5 357 142.85;5 357 142.85;2021-08-17 15:10:00;2021-08-24 15:10:00;Запрос ценовых предложений;Закупка состоялась1464;6184860-1;45208500-ОИ4;;"АО ""ЛОК ""Ок-Жетпес""";Товар;Кран шаровой;"""Кран шаровой латунный 11Б27П1 А30, ручка """"""""-""""рычаг"""" м/м Ду 15 Ру 25, вн-вн., применяемый материал: корпус: латунь ЛС59-1 ГОСТ 15527-2004 шаровая заслонка: латунь ЛС59-1 ГОСТ 15527-2004 с покрытием Н9Х уплотнение штока: фторопласт (PTFE) Рычаг: алюминиий марки АК-7 ГОСТ 1583-93 с покрытием эпоксиполиэфирной порошковой композицией красного цвета или рычаг из стали покрытой ПВХ. Рабочее давление: 1,6 МПа .За счет СС - 36 % и РБ - 64 %""";20;Штука;1 270.00;25 400.00;2021-08-17 14:45:09;2021-08-22 18:00:00;Из одного источника по несостоявшимся закупкам;Закупка не состоялась1465;6184860-1;45208400-ОИ4;;"АО ""ЛОК ""Ок-Жетпес""";Товар;Плита теплоизоляционная;"Минераловатная изоляция - утеплитель ""Экролл"" толщина 50мм, длина 10980мм, ширина 1220 мм, площадь 26,791 м 2. За счет СС - 36 % и РБ - 64 %";5;Штука;7 400.00;37 000.00;2021-08-17 14:45:09;2021-08-22 18:00:00;Из одного источника по несостоявшимся закупкам;Закупка не состоялась1466;6184860-1;45210662-ОИ4;;"АО ""ЛОК ""Ок-Жетпес""";Товар;Скотч;Скотч фольгированный полиэтиленовый однослойный 50мм*50 м.За счет СС - 36 % и РБ - 64 %;3;Штука;4 000.00;12 000.00;2021-08-17 14:45:09;2021-08-22 18:00:00;Из одного источника по несостоявшимся закупкам;Закупка не состоялась1467;6184860-1;45210582-ОИ4;;"АО ""ЛОК ""Ок-Жетпес""";Товар;Труба для внутренней канализации;Труба канализационная д.50 мм, 1 м. За счет собственных средств 36% и РБ 64%;10;Штука;500.00;5 000.00;2021-08-17 14:45:09;2021-08-22 18:00:00;Из одного источника по несостоявшимся закупкам;Закупка не состоялась1468;6184860-1;45210438-ОИ4;;"АО ""ЛОК ""Ок-Жетпес""";Товар;Заглушка резьбовая;"Заглушка д.15 мм (1/2"") с нар.резьбой, материал латунь.За счет СС - 36 % и РБ - 64 %";10;Штука;150.00;1 500.00;2021-08-17 14:45:09;2021-08-22 18:00:00;Из одного источника по несостоявшимся закупкам;Закупка не состоялась1469;6184860-1;45210412-ОИ4;;"АО ""ЛОК ""Ок-Жетпес""";Товар;Заглушка резьбовая;"Заглушка д.15 мм (1/2"") с вн.резьбой, материал латунь.За счет СС - 36 % и РБ - 64 %";10;Штука;200.00;2 000.00;2021-08-17 14:45:09;2021-08-22 18:00:00;Из одного источника по несостоявшимся закупкам;Закупка не состоялась1470;6184860-1;45209743-ОИ4;;"АО ""ЛОК ""Ок-Жетпес""";Товар;Переходник;"переходик металлический д. 1/2 ""/ 1/2"" За счет СС- 36% и РБ - 64%";20;Штука;210.00;4 200.00;2021-08-17 14:45:09;2021-08-22 18:00:00;Из одного источника по несостоявшимся закупкам;Закупка не состоялась1471;6184860-1;45209710-ОИ4;;"АО ""ЛОК ""Ок-Жетпес""";Товар;Лейка;Лейка д/душа 3 режима хром, FRAP F007, за счет СС- 36% и РБ - 64%;30;Штука;1 400.00;42 000.00;2021-08-17 14:45:09;2021-08-22 18:00:00;Из одного источника по несостоявшимся закупкам;Закупка не состоялась1472;6184860-1;45209680-ОИ4;;"АО ""ЛОК ""Ок-Жетпес""";Товар;Шланг;Gappo G42 Шланг для душа ПВХ армирован алюминиевой лентой 150 см, за счет СС- 36% и РБ - 64%;30;Штука;1 600.00;48 000.00;2021-08-17 14:45:09;2021-08-22 18:00:00;Из одного источника по несостоявшимся закупкам;Закупка не состоялась1473;6184860-1;45209487-ОИ4;;"АО ""ЛОК ""Ок-Жетпес""";Товар;Труба общего назначения;Труба ППР д. 32 мм с стекловолокном, белый (PN 20) 20 Jakko.За счет СС - 36 % и РБ - 64 %;24;Пог.м;815.00;19 560.00;2021-08-17 14:45:09;2021-08-22 18:00:00;Из одного источника по несостоявшимся закупкам;Закупка не состоялась